{
  "$schema": "https://grovealliance.org/fhir/catalog/schemas/package-graph.schema.json",
  "schemaVersion": 0,
  "fhirVersion": "4.0.1",
  "version": "0.7.0",
  "canonicalRoot": "https://grovealliance.org/fhir",
  "packages": [
    {
      "source": "mobile",
      "packageId": "org.grovealliance.fhir.mobile",
      "canonical": "https://grovealliance.org/fhir/mobile",
      "dependencies": [
        "hl7.terminology.r4#7.4.0",
        "hl7.fhir.uv.extensions.r4#5.3.0"
      ],
      "profiles": [
        "grove-application-device",
        "grove-host-device",
        "grove-mobile-active-energy",
        "grove-mobile-basal-body-temperature",
        "grove-mobile-basal-energy",
        "grove-mobile-blood-glucose-unspecified-specimen",
        "grove-mobile-blood-pressure",
        "grove-mobile-body-fat-percentage",
        "grove-mobile-body-height",
        "grove-mobile-body-temperature",
        "grove-mobile-body-water-mass",
        "grove-mobile-body-weight",
        "grove-mobile-bone-mass",
        "grove-mobile-cervical-mucus-quality",
        "grove-mobile-conversion-provenance",
        "grove-mobile-cycling-cadence",
        "grove-mobile-deep-sleep-duration",
        "grove-mobile-dietary-biotin",
        "grove-mobile-dietary-caffeine",
        "grove-mobile-dietary-calcium",
        "grove-mobile-dietary-carbohydrates",
        "grove-mobile-dietary-chloride",
        "grove-mobile-dietary-cholesterol",
        "grove-mobile-dietary-chromium",
        "grove-mobile-dietary-copper",
        "grove-mobile-dietary-energy",
        "grove-mobile-dietary-fat-monounsaturated",
        "grove-mobile-dietary-fat-polyunsaturated",
        "grove-mobile-dietary-fat-saturated",
        "grove-mobile-dietary-fat-total",
        "grove-mobile-dietary-fiber",
        "grove-mobile-dietary-folate",
        "grove-mobile-dietary-iodine",
        "grove-mobile-dietary-iron",
        "grove-mobile-dietary-magnesium",
        "grove-mobile-dietary-manganese",
        "grove-mobile-dietary-molybdenum",
        "grove-mobile-dietary-niacin",
        "grove-mobile-dietary-pantothenic-acid",
        "grove-mobile-dietary-phosphorus",
        "grove-mobile-dietary-potassium",
        "grove-mobile-dietary-protein",
        "grove-mobile-dietary-riboflavin",
        "grove-mobile-dietary-selenium",
        "grove-mobile-dietary-sodium",
        "grove-mobile-dietary-sugar",
        "grove-mobile-dietary-thiamin",
        "grove-mobile-dietary-vitamin-a",
        "grove-mobile-dietary-vitamin-b12",
        "grove-mobile-dietary-vitamin-b6",
        "grove-mobile-dietary-vitamin-c",
        "grove-mobile-dietary-vitamin-d",
        "grove-mobile-dietary-vitamin-e",
        "grove-mobile-dietary-vitamin-k",
        "grove-mobile-dietary-zinc",
        "grove-mobile-distance",
        "grove-mobile-electrodermal-activity",
        "grove-mobile-exchange-bundle",
        "grove-mobile-flights-climbed",
        "grove-mobile-fluid-intake",
        "grove-mobile-heart-rate",
        "grove-mobile-heart-rate-variability-rmssd",
        "grove-mobile-heart-rate-variability-sdnn",
        "grove-mobile-intermenstrual-bleeding",
        "grove-mobile-lean-body-mass",
        "grove-mobile-light-sleep-duration",
        "grove-mobile-menstruation-flow",
        "grove-mobile-mindfulness-session",
        "grove-mobile-observation",
        "grove-mobile-ovulation-test-result",
        "grove-mobile-oxygen-saturation",
        "grove-mobile-oxygen-saturation-daily-average",
        "grove-mobile-power",
        "grove-mobile-rem-sleep-duration",
        "grove-mobile-respiratory-rate",
        "grove-mobile-respiratory-rate-average",
        "grove-mobile-resting-heart-rate",
        "grove-mobile-retraction-bundle",
        "grove-mobile-retraction-provenance",
        "grove-mobile-sexual-activity",
        "grove-mobile-skin-temperature",
        "grove-mobile-sleep-awake-duration",
        "grove-mobile-sleep-duration",
        "grove-mobile-sleep-heart-rate",
        "grove-mobile-sleep-stage",
        "grove-mobile-speed",
        "grove-mobile-step-count",
        "grove-mobile-vo2-max",
        "grove-mobile-wheelchair-push-count",
        "grove-mobile-workout",
        "grove-mobile-workout-segment",
        "grove-recording-device"
      ]
    },
    {
      "source": "questionnaire",
      "packageId": "org.grovealliance.fhir.questionnaire",
      "canonical": "https://grovealliance.org/fhir/questionnaire",
      "dependencies": [
        "hl7.fhir.uv.sdc#4.0.0",
        "hl7.fhir.uv.extensions.r4#5.3.0"
      ],
      "profiles": [
        "grove-questionnaire",
        "grove-questionnaire-response"
      ]
    },
    {
      "source": "sensor",
      "packageId": "org.grovealliance.fhir.sensor",
      "canonical": "https://grovealliance.org/fhir/sensor",
      "dependencies": [
        "hl7.terminology.r4#7.4.0",
        "hl7.fhir.uv.extensions.r4#5.3.0",
        "org.grovealliance.fhir.mobile#0.7.0"
      ],
      "profiles": [
        "grove-sensor-conversion-provenance",
        "grove-sensor-ecg-observation",
        "grove-sensor-recording-document",
        "grove-sensor-sampled-data-observation"
      ]
    },
    {
      "source": "sensorkit",
      "packageId": "org.grovealliance.fhir.sensorkit",
      "canonical": "https://grovealliance.org/fhir/sensorkit",
      "dependencies": [
        "hl7.terminology.r4#7.4.0",
        "hl7.fhir.uv.extensions.r4#5.3.0",
        "org.grovealliance.fhir.mobile#0.7.0",
        "org.grovealliance.fhir.sensor#0.7.0"
      ],
      "profiles": [
        "sensorkit-accelerometer-observation",
        "sensorkit-conversion-provenance",
        "sensorkit-device-usage-observation",
        "sensorkit-ecg-observation",
        "sensorkit-keyboard-metrics-observation",
        "sensorkit-messages-usage-observation",
        "sensorkit-observation",
        "sensorkit-on-wrist-observation",
        "sensorkit-phone-usage-observation",
        "sensorkit-ppg-observation",
        "sensorkit-recording-document",
        "sensorkit-sleep-session-observation",
        "sensorkit-visit-observation",
        "sensorkit-wrist-temperature-observation"
      ]
    },
    {
      "source": "healthkit",
      "packageId": "org.grovealliance.fhir.healthkit",
      "canonical": "https://grovealliance.org/fhir/healthkit",
      "dependencies": [
        "hl7.terminology.r4#7.4.0",
        "hl7.fhir.uv.extensions.r4#5.3.0",
        "org.grovealliance.fhir.mobile#0.7.0",
        "org.grovealliance.fhir.sensor#0.7.0"
      ],
      "profiles": [
        "healthkit-apple-exercise-time",
        "healthkit-apple-move-time",
        "healthkit-apple-stand-hour",
        "healthkit-apple-stand-time",
        "healthkit-application-device",
        "healthkit-atrial-fibrillation-burden",
        "healthkit-audiogram-panel",
        "healthkit-biological-sex",
        "healthkit-bladder-incontinence",
        "healthkit-bleeding-after-pregnancy",
        "healthkit-bleeding-during-pregnancy",
        "healthkit-blood-alcohol-content",
        "healthkit-blood-type",
        "healthkit-clinical-record-document",
        "healthkit-contraceptive-use",
        "healthkit-conversion-provenance",
        "healthkit-cycling-functional-threshold-power",
        "healthkit-date-of-birth",
        "healthkit-ecg-average-heart-rate-observation",
        "healthkit-ecg-observation",
        "healthkit-environmental-audio-exposure",
        "healthkit-environmental-audio-exposure-notification",
        "healthkit-environmental-sound-reduction",
        "healthkit-fitzpatrick-skin-type",
        "healthkit-food-correlation",
        "healthkit-forced-expiratory-volume-1",
        "healthkit-forced-vital-capacity",
        "healthkit-gad7-assessment",
        "healthkit-handwashing-session",
        "healthkit-headphone-audio-exposure",
        "healthkit-headphone-audio-exposure-notification",
        "healthkit-heart-rate-recovery-one-minute",
        "healthkit-high-heart-rate-notification",
        "healthkit-hypertension-notification",
        "healthkit-infrequent-menstrual-cycles",
        "healthkit-inhaler-usage",
        "healthkit-insulin-delivery",
        "healthkit-irregular-heart-rhythm-notification",
        "healthkit-irregular-menstrual-cycles",
        "healthkit-lactation-status",
        "healthkit-low-cardio-fitness-notification",
        "healthkit-low-heart-rate-notification",
        "healthkit-medication-dose-event",
        "healthkit-number-of-alcoholic-beverages",
        "healthkit-number-of-times-fallen",
        "healthkit-observation",
        "healthkit-peak-expiratory-flow-rate",
        "healthkit-peripheral-perfusion-index",
        "healthkit-persistent-intermenstrual-bleeding",
        "healthkit-phq9-assessment",
        "healthkit-physical-effort",
        "healthkit-pregnancy-status",
        "healthkit-pregnancy-test-result",
        "healthkit-progesterone-test-result",
        "healthkit-prolonged-menstrual-periods",
        "healthkit-recording-document",
        "healthkit-running-ground-contact-time",
        "healthkit-running-stride-length",
        "healthkit-running-vertical-oscillation",
        "healthkit-six-minute-walk-test-distance",
        "healthkit-sleep-apnea-notification",
        "healthkit-sleeping-breathing-disturbances",
        "healthkit-stair-ascent-speed",
        "healthkit-stair-descent-speed",
        "healthkit-state-of-mind",
        "healthkit-swimming-stroke-count",
        "healthkit-symptom-abdominal-cramps",
        "healthkit-symptom-acne",
        "healthkit-symptom-appetite-changes",
        "healthkit-symptom-bloating",
        "healthkit-symptom-breast-pain",
        "healthkit-symptom-chest-tightness-or-pain",
        "healthkit-symptom-chills",
        "healthkit-symptom-constipation",
        "healthkit-symptom-coughing",
        "healthkit-symptom-diarrhea",
        "healthkit-symptom-dizziness",